{
  "schema_version": "1.0",
  "task_id": "11111111-1111-4111-8111-111111111111",
  "entity_uuid": "019997c0-0000-7000-8000-000000000001",
  "projection_version": 3,
  "target_collection": "catalog_items_current",
  "target_schema_version": "1.0",
  "artifact": {
    "uri": "s3://artifacts/normalized/aa/aaaaaaaaaaaaaaaaaaaaaaaaaaaaaaaaaaaaaaaaaaaaaaaaaaaaaaaaaaaaaaaa",
    "sha256": "aaaaaaaaaaaaaaaaaaaaaaaaaaaaaaaaaaaaaaaaaaaaaaaaaaaaaaaaaaaaaaaa",
    "size_bytes": 1024,
    "media_type": "application/json",
    "schema_version": "1.0",
    "entity_uuid": "019997c0-0000-7000-8000-000000000001",
    "domain": "catalog",
    "parser_version": "catalog-parser/1.0.0",
    "fetch_id": "22222222-2222-4222-8222-222222222222",
    "raw_sha256": "bbbbbbbbbbbbbbbbbbbbbbbbbbbbbbbbbbbbbbbbbbbbbbbbbbbbbbbbbbbbbbbb",
    "raw_uri": "s3://artifacts/raw/bb/bbbbbbbbbbbbbbbbbbbbbbbbbbbbbbbbbbbbbbbbbbbbbbbbbbbbbbbbbbbbbbbb",
    "produced_at": "2026-09-01T12:01:00Z"
  },
  "priority": 10,
  "not_before": null,
  "issued_at": "2026-09-01T12:00:00Z"
}
